{
  "$schema": "https://luckread.com/contracts/v1/entity/entity-implementation-evidence.v1.schema.json",
  "version": "1.0",
  "status": "NOT_GREEN",
  "sourceOfTruth": "contracts/entity/entity-catalog.v1.json",
  "records": [
    {
      "entityId": "ENT-USER",
      "catalogStatus": "VERIFIED",
      "implementationStatus": "IMPLEMENTED",
      "implementationRefs": [
        "workers/W01-payload/src/collections/Users.ts",
        "workers/W01-payload/src/payload.config.ts"
      ],
      "schemaEvidenceRefs": [
        "workers/W01-payload/src/collections/Users.ts"
      ],
      "migrationEvidenceRefs": [
        "workers/W01-payload/src/payload.config.ts",
        "artifacts/evidence/auth-002-remote-baseline/run-35508571153.json"
      ],
      "payloadNativeEvidenceRefs": [],
      "extensionEvidenceRefs": [
        "workers/W01-payload/src/collections/Users.ts"
      ],
      "blockers": [
        "AUTH-002 native session runtime, extension correlation, and final Evidence Registry promotion remain open."
      ],
      "status": "NOT_GREEN"
    },
    {
      "entityId": "ENT-IDENTITY",
      "catalogStatus": "PROPOSED",
      "implementationStatus": "IMPLEMENTED",
      "implementationRefs": [
        "workers/W02-identity/src/account/registration-materializer.ts"
      ],
      "schemaEvidenceRefs": [
        "https://github.com/wanghuinet/luckread/actions/runs/36298629648"
      ],
      "migrationEvidenceRefs": [
        "workers/W02-identity/migrations/0004_auth_003_credentials.sql",
        "https://github.com/wanghuinet/luckread/actions/runs/36296831559"
      ],
      "payloadNativeEvidenceRefs": [],
      "extensionEvidenceRefs": [
        "workers/W02-identity/src/credentials/credential-add.ts",
        "https://github.com/wanghuinet/luckread/actions/runs/36299334577",
        "https://github.com/wanghuinet/luckread/actions/runs/36307891924",
        "https://github.com/wanghuinet/luckread/actions/runs/36308120758",
        "https://github.com/wanghuinet/luckread/actions/runs/36377880967",
        "docs/change-control/CC-MAPPING-0-AUTH-003-IDENTITY-MATERIALIZATION-EVIDENCE-ADMISSION-2026-09-28.md"
      ],
      "blockers": [
        "AUTH-001 W02 scheduled registration materializer now provides exact-SHA executable identity materialization evidence; no independent public identity CRUD lifecycle is claimed by this admission.",
        "Canonical entity catalog promotion remains blocked because ENT-IDENTITY is still PROPOSED and global Mapping 0 / Five-Way remains NOT_GREEN."
      ],
      "status": "BLOCKED"
    },
    {
      "entityId": "ENT-CREDENTIAL",
      "catalogStatus": "PROPOSED",
      "implementationStatus": "IMPLEMENTED",
      "implementationRefs": [
        "workers/W02-identity/src/credentials/credential-add.ts",
        "workers/W02-identity/migrations/0004_auth_003_credentials.sql",
        "workers/W02-identity/src/credentials/credential-list.ts",
        "workers/W02-identity/src/credentials/credential-lifecycle.ts"
      ],
      "schemaEvidenceRefs": [
        "https://github.com/wanghuinet/luckread/actions/runs/36298629648"
      ],
      "migrationEvidenceRefs": [
        "workers/W02-identity/migrations/0004_auth_003_credentials.sql",
        "https://github.com/wanghuinet/luckread/actions/runs/36296831559"
      ],
      "payloadNativeEvidenceRefs": [],
      "extensionEvidenceRefs": [
        "workers/W02-identity/src/credentials/credential-add.ts",
        "https://github.com/wanghuinet/luckread/actions/runs/36299334577",
        "https://github.com/wanghuinet/luckread/actions/runs/36307891924",
        "https://github.com/wanghuinet/luckread/actions/runs/36308120758"
      ],
      "blockers": [
        "ENT-CREDENTIAL runtime/persistence evidence is complete for the admitted AUTH-003 List/Add/Replace/Remove slice.",
        "Canonical catalog promotion remains blocked because ENT-IDENTITY is still PROPOSED and final Mapping 0 / Five-Way reconciliation is NOT_GREEN.",
        "No promotion is inferred from the credential entity's dependency on auth_identities."
      ],
      "status": "BLOCKED"
    },
    {
      "entityId": "ENT-CONSENT",
      "catalogStatus": "PROPOSED",
      "implementationStatus": "CONTRACT_ONLY",
      "implementationRefs": [],
      "schemaEvidenceRefs": [],
      "migrationEvidenceRefs": [],
      "payloadNativeEvidenceRefs": [],
      "extensionEvidenceRefs": [],
      "blockers": [
        "PRIV-002 concrete consent contract is admitted, but runtime implementation and physical persistence evidence are not yet verified.",
        "AUTH-001 registration consent transaction, withdrawal propagation, security/privacy E2E, and Evidence Registry admission remain pending.",
        "Final Mapping 0 / Five-Way validation remains NOT_GREEN."
      ],
      "status": "BLOCKED"
    },
    {
      "entityId": "ENT-SESSION",
      "catalogStatus": "PROPOSED",
      "implementationStatus": "IMPLEMENTED",
      "implementationRefs": [
        "workers/W02-identity/src/session/session-runtime.ts",
        "workers/W02-identity/src/index.ts",
        "workers/W01-payload/src/app/auth/login/route.ts",
        "workers/W01-payload/src/app/auth/refresh/route.ts",
        "workers/W01-payload/src/app/auth/logout/route.ts"
      ],
      "schemaEvidenceRefs": [
        "workers/W01-payload/src/migrations/20260921_003203_MIG_AUTH_002_SESSION_V1.ts",
        "contracts/persistence/AUTH-002-minimum-session-extension-persistence-contract.v1.1.json",
        "artifacts/mapping-0/auth-002-e6-runtime-evidence-reconciliation-2026-09-26.json"
      ],
      "migrationEvidenceRefs": [
        "workers/W01-payload/src/migrations/20260921_003203_MIG_AUTH_002_SESSION_V1.ts",
        "https://github.com/wanghuinet/luckread/actions/runs/36217784262",
        "https://github.com/wanghuinet/luckread/actions/runs/36219132123",
        "artifacts/mapping-0/auth-002-historical-migration-evidence-admission-2026-09-28.json",
        "docs/change-control/CC-MAPPING-0-AUTH-002-HISTORICAL-MIGRATION-EVIDENCE-ADMISSION-2026-09-28.md",
        "https://github.com/wanghuinet/luckread/actions/runs/35552919573/artifacts/10618729380"
      ],
      "payloadNativeEvidenceRefs": [
        "https://github.com/wanghuinet/luckread/actions/runs/36219132123"
      ],
      "extensionEvidenceRefs": [
        "workers/W02-identity/src/session/session-runtime.ts",
        "workers/W02-identity/src/session/session-runtime.test.ts",
        "https://github.com/wanghuinet/luckread/actions/runs/36219132123"
      ],
      "blockers": [
        "Gate-1 schema, native session runtime, security-negative, concurrency and extension-correlation evidence are now VERIFIED at the exact tested source 5c3b7830b146f8bd998a0fab52bb1fb6ddeb0f55.",
        "ENT-SESSION catalog promotion remains blocked pending final Mapping 0 / Five-Way admission."
      ],
      "status": "BLOCKED"
    },
    {
      "entityId": "ENT-VERIFICATION",
      "catalogStatus": "PROPOSED",
      "implementationStatus": "CONTRACT_ONLY",
      "implementationRefs": [],
      "schemaEvidenceRefs": [],
      "migrationEvidenceRefs": [],
      "payloadNativeEvidenceRefs": [],
      "extensionEvidenceRefs": [],
      "blockers": [
        "No concrete implementation evidence recorded."
      ],
      "status": "BLOCKED"
    },
    {
      "entityId": "ENT-DEVICE-RECORD",
      "catalogStatus": "PROPOSED",
      "implementationStatus": "CONTRACT_ONLY",
      "implementationRefs": [],
      "schemaEvidenceRefs": [],
      "migrationEvidenceRefs": [],
      "payloadNativeEvidenceRefs": [],
      "extensionEvidenceRefs": [],
      "blockers": [
        "No concrete implementation evidence recorded."
      ],
      "status": "BLOCKED"
    },
    {
      "entityId": "ENT-ROLE-ASSIGNMENT",
      "catalogStatus": "PROPOSED",
      "implementationStatus": "IMPLEMENTED",
      "implementationRefs": [
        "workers/W02-identity/src/authz/role-assignment.ts",
        "workers/W02-identity/src/index.ts"
      ],
      "schemaEvidenceRefs": [
        "workers/W02-identity/migrations/0001_role_assignments.sql"
      ],
      "migrationEvidenceRefs": [
        "workers/W02-identity/migrations/0001_role_assignments.sql",
        "scripts/generate-role-assignment-migration.mjs",
        "https://github.com/wanghuinet/luckread/actions/runs/35793128427",
        "https://github.com/wanghuinet/luckread/actions/runs/35793310927"
      ],
      "payloadNativeEvidenceRefs": [],
      "extensionEvidenceRefs": [
        "workers/W02-identity/src/authz/role-assignment.ts",
        "https://github.com/wanghuinet/luckread/actions/runs/35793226740"
      ],
      "blockers": [
        "Controlled authLogin/authRefresh runtime evidence is pending.",
        "Controlled authLogin/authRefresh runtime evidence and W01 Service Binding deployment evidence are pending."
      ],
      "status": "BLOCKED"
    },
    {
      "entityId": "ENT-ENTITLEMENT-GRANT",
      "catalogStatus": "PROPOSED",
      "implementationStatus": "CONTRACT_ONLY",
      "implementationRefs": [],
      "schemaEvidenceRefs": [],
      "migrationEvidenceRefs": [],
      "payloadNativeEvidenceRefs": [],
      "extensionEvidenceRefs": [],
      "blockers": [
        "No concrete implementation evidence recorded."
      ],
      "status": "BLOCKED"
    },
    {
      "entityId": "ENT-SUBSCRIPTION",
      "catalogStatus": "PROPOSED",
      "implementationStatus": "BLOCKED",
      "implementationRefs": [
        "workers/W07-subscription-commerce/src/index.ts",
        "workers/W07-subscription-commerce/src/subscription-runtime.ts",
        "workers/W07-subscription-commerce/src/subscription-runtime.test.ts",
        "workers/W07-subscription-commerce/migrations/0002_subscription_version_cas.sql",
        "docs/change-control/CC-MON-SUBSCRIPTION-VERSION-CAS-IMPLEMENTATION-2026-10-27.md"
      ],
      "schemaEvidenceRefs": [
        "contracts/entity/SUBSCRIPTION-ENTITY-CONTRACT.v1.json",